{
  "v": "8.0.5",
  "p": {
    "layers": [
      {
        "name": "0",
        "visible": true,
        "selectable": true,
        "movable": true,
        "editable": true
      }
    ],
    "autoAdjustIndex": true,
    "hierarchicalRendering": true
  },
  "a": {
    "width": 100,
    "height": 100,
    "fitContent": true,
    "rectSelectable": false,
    "zoomable": false,
    "pannable": false
  },
  "d": [
    {
      "c": "ht.Node",
      "i": 17092,
      "p": {
        "displayName": "单折线图",
        "image": "symbols/公共资源/HTDD/charts/lineCharts/Line1.json",
        "position": {
          "x": 280,
          "y": 188
        },
        "width": 560.0,
        "height": 376.0
      }
    }
  ],
  "contentRect": {
    "x": 0.0,
    "y": 0.0,
    "width": 560.0,
    "height": 376.0
  }
}