{
  "v": "8.0.5",
  "p": {
    "layers": [
      {
        "name": "0",
        "visible": true,
        "selectable": true,
        "movable": true,
        "editable": true
      }
    ],
    "autoAdjustIndex": true,
    "hierarchicalRendering": true
  },
  "a": {
    "width": 800,
    "fitContent": true,
    "rectSelectable": false,
    "pannable": true,
    "zoomable": true,
    "height": 800
  },
  "d": [],
  "contentRect": {
    "x": 0,
    "y": 0,
    "width": 800,
    "height": 800
  }
}